{"$id":"urn:night-voyager:schema:evidence-loop-a2-contract-basis-v1","$schema":"https://json-schema.org/draft/2020-12/schema","additionalProperties":false,"properties":{"a2_model_sources":{"items":{"additionalProperties":false,"properties":{"path":{"minLength":1,"type":"string"},"sha256":{"pattern":"^[0-9a-f]{64}$","type":"string"}},"required":["path","sha256"],"type":"object"},"maxItems":4,"minItems":4,"type":"array","uniqueItems":true},"exact_head":{"const":"3c7936fc58ecbf53c2e4b4735bed5ab9ac29b9d3","pattern":"^[0-9a-f]{40}$","type":"string"},"provider_lock_fixture":{"additionalProperties":false,"properties":{"path":{"minLength":1,"type":"string"},"sha256":{"pattern":"^[0-9a-f]{64}$","type":"string"}},"required":["path","sha256"],"type":"object"},"schema_version":{"const":"night-voyager.evidence-loop-a2-contract-basis.v1","type":"string"},"source_pack_entry_model_source":{"additionalProperties":false,"properties":{"path":{"minLength":1,"type":"string"},"sha256":{"pattern":"^[0-9a-f]{64}$","type":"string"}},"required":["path","sha256"],"type":"object"}},"required":["schema_version","exact_head","provider_lock_fixture","a2_model_sources","source_pack_entry_model_source"],"title":"Night Voyager Slice 0 A2 Contract Basis V1","type":"object"}
