{"a2_model_sources":[{"path":"src/night_voyager/evidence_loop/models.py","sha256":"ec925c0efac7485ea93be487ae6adc62969ce36a1c3b321f10e6498c340e1349"},{"path":"src/night_voyager/evidence_loop/provider_locks.py","sha256":"19140c82809723c97670251c94220f448f2a22da2ddfee75cee114c5d3beed36"},{"path":"src/night_voyager/evidence_loop/mke_v2.py","sha256":"809ce11645fe6b33c699fc21f395536253a10e967f066c35ec1a37a7b59cc438"},{"path":"src/night_voyager/evidence_loop/dra_baseline.py","sha256":"a252388dd4fc022ba6937ca113e2efeb68bc81aa2ef0db957a9785072b5bdd25"}],"exact_head":"3c7936fc58ecbf53c2e4b4735bed5ab9ac29b9d3","provider_lock_fixture":{"path":"tests/fixtures/evidence_loop/provider-locks-v1.json","sha256":"95b29c79ae8e234500c5f9e391da9a8e271bf2b479928566c55e1d32fe34b6ae"},"schema_version":"night-voyager.evidence-loop-a2-contract-basis.v1","source_pack_entry_model_source":{"path":"src/night_voyager/planning/models.py","sha256":"1d03e4c468b9ed01117bd1f1a86e184fe8e7c12454e56c70148dec6483e02fee"}}
